{
  "schema_version": 6,
  "id": "necromancer",
  "name": "Necromancer",
  "healing": {
    "base_modifier": -2
  },
  "carry_bonus": 5,
  "level_gains": { "hp": 6, "mana": 9, "move": 3 },
  "ability_ids": ["spell.death-coil", "spell.summon", "spell.cure"],
  "trainable_ability_ids": ["spell.stoneskin", "spell.haste"],
  "description": "A dark caster who drains life and commands minions. Necromancers wither foes with death coil, summon servants and mend with cure; their own regeneration is poor, so they lean on stolen life and pets."
}
